{
  "schemaVersion": "chatgpt.browser_control.operation_control_receipt.v1",
  "controlActionId": "22222222-2222-4222-8222-222222222222",
  "parentOperationId": "11111111-1111-4111-8111-111111111111",
  "parentRequestDigest": "hmac-sha256:aaaaaaaaaaaaaaaaaaaaaaaaaaaaaaaaaaaaaaaaaaaaaaaaaaaaaaaaaaaaaaaa",
  "parentTargetBindingDigest": "hmac-sha256:bbbbbbbbbbbbbbbbbbbbbbbbbbbbbbbbbbbbbbbbbbbbbbbbbbbbbbbbbbbbbbbb",
  "expectedAssistantTurnId": "assistant-turn-1",
  "requestDigest": "hmac-sha256:abababababababababababababababababababababababababababababababab",
  "action": "steer",
  "outcome": "satisfied",
  "evidenceDigest": "hmac-sha256:cdcdcdcdcdcdcdcdcdcdcdcdcdcdcdcdcdcdcdcdcdcdcdcdcdcdcdcdcdcdcdcd",
  "observedAt": "2026-08-16T00:00:04.000Z"
}
